{
  "schema_version": 1,
  "profile_id": "default",
  "track_id": "data-analytics.zero-to-job",
  "release_version": 1,
  "title": "С нуля до Data Analyst — недели 1–4",
  "start_week": 1,
  "end_week": 4,
  "topics": [
    {
      "id": "foundations.data-tables",
      "title": "Строка, столбец и зерно таблицы",
      "prerequisites": [],
      "status": "active"
    },
    {
      "id": "foundations.data-types",
      "title": "Типы данных и форматы",
      "prerequisites": ["foundations.data-tables"],
      "status": "active"
    },
    {
      "id": "foundations.missing-duplicates",
      "title": "Пропуски и дубликаты",
      "prerequisites": ["foundations.data-types"],
      "status": "active"
    },
    {
      "id": "foundations.quality-checks",
      "title": "Пять базовых проверок качества",
      "prerequisites": ["foundations.missing-duplicates"],
      "status": "active"
    },
    {
      "id": "foundations.data-passport",
      "title": "CSV, XLSX и паспорт датасета",
      "prerequisites": ["foundations.quality-checks"],
      "status": "active"
    },
    {
      "id": "spreadsheets.formulas",
      "title": "Формулы и порядок вычислений",
      "prerequisites": ["foundations.data-passport"],
      "status": "active"
    },
    {
      "id": "spreadsheets.references",
      "title": "Относительные и абсолютные ссылки",
      "prerequisites": ["spreadsheets.formulas"],
      "status": "active"
    },
    {
      "id": "spreadsheets.sort-filter",
      "title": "Сортировка и фильтры без искажения таблицы",
      "prerequisites": ["spreadsheets.references"],
      "status": "active"
    },
    {
      "id": "spreadsheets.cleaning",
      "title": "Очистка текста, чисел и дат",
      "prerequisites": ["spreadsheets.sort-filter"],
      "status": "active"
    },
    {
      "id": "spreadsheets.basic-metrics",
      "title": "Сумма, среднее, медиана и доля",
      "prerequisites": ["spreadsheets.cleaning"],
      "status": "active"
    },
    {
      "id": "spreadsheets.logic",
      "title": "IF, AND и OR",
      "prerequisites": ["spreadsheets.basic-metrics"],
      "status": "active"
    },
    {
      "id": "spreadsheets.conditional-aggregates",
      "title": "SUMIF(S) и COUNTIF(S)",
      "prerequisites": ["spreadsheets.logic"],
      "status": "active"
    },
    {
      "id": "spreadsheets.lookups",
      "title": "XLOOKUP и контроль соединения",
      "prerequisites": ["spreadsheets.conditional-aggregates"],
      "status": "active"
    },
    {
      "id": "spreadsheets.pivots",
      "title": "Сводные таблицы",
      "prerequisites": ["spreadsheets.lookups"],
      "status": "active"
    },
    {
      "id": "spreadsheets.reproducible-report",
      "title": "Воспроизводимый табличный отчёт",
      "prerequisites": ["spreadsheets.pivots"],
      "status": "active"
    },
    {
      "id": "spreadsheets.chart-choice",
      "title": "Выбор графика по вопросу",
      "prerequisites": ["spreadsheets.reproducible-report"],
      "status": "active"
    },
    {
      "id": "spreadsheets.chart-integrity",
      "title": "Честные оси и визуальные ошибки",
      "prerequisites": ["spreadsheets.chart-choice"],
      "status": "active"
    },
    {
      "id": "spreadsheets.dashboard-layout",
      "title": "Иерархия простого дашборда",
      "prerequisites": ["spreadsheets.chart-integrity"],
      "status": "active"
    },
    {
      "id": "spreadsheets.validation",
      "title": "Валидация ввода и обработка ошибок",
      "prerequisites": ["spreadsheets.dashboard-layout"],
      "status": "active"
    },
    {
      "id": "spreadsheets.business-summary",
      "title": "Вывод, доказательство и ограничение",
      "prerequisites": ["spreadsheets.validation"],
      "status": "active"
    }
  ],
  "lessons": [
    {
      "id": "foundations.data-tables.lesson",
      "topic_id": "foundations.data-tables",
      "title": "Строка, столбец и зерно таблицы",
      "body": "# Как аналитик видит таблицу\n\nТаблица описывает объекты или события. Одна строка — одно наблюдение, столбец — один признак, а ячейка — значение признака для наблюдения. Смысл одной строки называют **зерном**.\n\n| sale_id | date | city | amount |\n| --- | --- | --- | ---: |\n| 101 | 2026-08-15 | Москва | 1200 |\n| 102 | 2026-08-15 | Казань | 900 |\n\nЗдесь зерно — одна продажа. До расчётов сформулируйте зерно одним предложением и найдите поле, которое должно однозначно идентифицировать строку.",
      "estimated_minutes": 6,
      "check": {
        "question": "Что описывает одна строка в примере?",
        "rule": {
          "mode": "normalized",
          "expected_answers": [
            "одну продажу",
            "продажу",
            "одно событие продажи"
          ]
        }
      },
      "status": "active"
    },
    {
      "id": "foundations.data-types.lesson",
      "topic_id": "foundations.data-types",
      "title": "Типы данных и форматы",
      "body": "# Тип определяет допустимые операции\n\nЧисло можно складывать, дату — сравнивать по времени, текст — искать и объединять. Вид значения не гарантирует правильный тип: `\"1200\"` может быть текстом, а `01.02.03` — неоднозначной датой.\n\nРазличайте **смысл** и **хранение**. Телефон состоит из цифр, но является идентификатором: складывать телефоны бессмысленно. Сумма заказа — числовая мера. Дату храните в однозначном формате `YYYY-MM-DD`, а категорию — в согласованном словаре.",
      "estimated_minutes": 7,
      "check": {
        "question": "Почему номер телефона обычно считают текстом, а не числом?",
        "rule": {
          "mode": "normalized",
          "expected_answers": [
            "это идентификатор",
            "номер телефона это идентификатор",
            "его не складывают",
            "телефоны не складывают"
          ]
        }
      },
      "status": "active"
    },
    {
      "id": "foundations.missing-duplicates.lesson",
      "topic_id": "foundations.missing-duplicates",
      "title": "Пропуски и дубликаты",
      "body": "# Две разные проблемы качества\n\nПропуск означает отсутствие известного значения. Причины различаются: значение не собирали, оно неприменимо или потерялось. Поэтому нельзя автоматически заменять все пропуски нулём.\n\nДубликат определяется относительно зерна. Полностью одинаковые строки могут быть технической копией, а одинаковые customer_id — нормальны, если зерно таблицы «одна покупка». Сначала назовите ключ зерна, затем проверяйте его уникальность.",
      "estimated_minutes": 7,
      "check": {
        "question": "Можно ли всегда заменить пропуск нулём?",
        "rule": {
          "mode": "normalized",
          "expected_answers": ["нет", "нельзя", "нет нельзя", "не всегда"]
        }
      },
      "status": "active"
    },
    {
      "id": "foundations.quality-checks.lesson",
      "topic_id": "foundations.quality-checks",
      "title": "Пять базовых проверок качества",
      "body": "# Минимальный data quality checklist\n\nПеред анализом проверьте: соответствие зерну, уникальность ключа, полноту обязательных полей, допустимость значений и согласованность типов/форматов. Дополнительно полезно оценить свежесть данных.\n\nПроверка должна быть измеримой: не «данные хорошие», а «sale_id уникален в 10 000 из 10 000 строк» или «amount неотрицателен во всех строках». Для каждой ошибки зафиксируйте количество, пример и решение.",
      "estimated_minutes": 7,
      "check": {
        "question": "Назовите проверку, которая обнаружит отрицательную сумму продажи.",
        "rule": {
          "mode": "normalized",
          "expected_answers": [
            "допустимость значений",
            "проверка диапазона",
            "диапазон",
            "amount неотрицателен",
            "проверка на отрицательные значения"
          ]
        }
      },
      "status": "active"
    },
    {
      "id": "foundations.data-passport.lesson",
      "topic_id": "foundations.data-passport",
      "title": "CSV, XLSX и паспорт датасета",
      "body": "# Сделайте данные понятными другому человеку\n\nCSV — текстовый табличный формат: важны кодировка, разделитель и десятичный знак. XLSX может хранить формулы, форматирование и несколько листов, поэтому внешний вид способен скрывать исходное значение.\n\nПаспорт датасета содержит источник, период, зерно, число строк, ключ, словарь полей, ограничения и результаты проверок качества. Он отделяет факты о данных от выводов анализа и помогает воспроизвести работу.",
      "estimated_minutes": 7,
      "check": {
        "question": "Какой пункт паспорта объясняет смысл одной строки?",
        "rule": {
          "mode": "normalized",
          "expected_answers": ["зерно", "зерно таблицы", "описание зерна"]
        }
      },
      "status": "active"
    },
    {
      "id": "spreadsheets.formulas.lesson",
      "topic_id": "spreadsheets.formulas",
      "title": "Формулы и порядок вычислений",
      "body": "# Расчёт должен жить в формуле\n\nФормула начинается со знака `=` и ссылается на ячейки, а не переписывает их значения. Операции выполняются с обычным приоритетом: скобки, степени, умножение/деление, сложение/вычитание.\n\nДля строки заказа `=C2*D2` вычисляет выручку из количества и цены. Если исходные данные изменятся, результат пересчитается. Проверяйте формулу на нескольких строках, включая ноль и необычно большое значение.",
      "estimated_minutes": 6,
      "check": {
        "question": "Почему ссылка =C2*D2 лучше вручную введённой суммы?",
        "rule": {
          "mode": "normalized",
          "expected_answers": [
            "она пересчитывается",
            "формула пересчитывается",
            "зависит от исходных данных",
            "обновляется автоматически"
          ]
        }
      },
      "status": "active"
    },
    {
      "id": "spreadsheets.references.lesson",
      "topic_id": "spreadsheets.references",
      "title": "Относительные и абсолютные ссылки",